{"receipt_id":"55555555-5555-4555-8555-555555555555","packet_id":"550e8400-e29b-41d4-a716-446655440003","action_hash":"sha256:aaaaaaaaaaaaaaaaaaaaaaaaaaaaaaaaaaaaaaaaaaaaaaaaaaaaaaaaaaaaaaa4","input_hash":"sha256:bbbbbbbbbbbbbbbbbbbbbbbbbbbbbbbbbbbbbbbbbbbbbbbbbbbbbbbbbbbbbbb4","policy_hash":"sha256:ccccccccccccccccccccccccccccccccccccccccccccccccccccccccccccccc4","decision":"STEP_UP","timestamp":"2026-06-16T12:00:00Z","signature":"ed25519:step-up-fixture-signature"}
