{"receipt_id":"44444444-4444-4444-8444-444444444444","packet_id":"550e8400-e29b-41d4-a716-446655440005","action_hash":"sha256:aaaaaaaaaaaaaaaaaaaaaaaaaaaaaaaaaaaaaaaaaaaaaaaaaaaaaaaaaaaaaaa3","input_hash":"sha256:bbbbbbbbbbbbbbbbbbbbbbbbbbbbbbbbbbbbbbbbbbbbbbbbbbbbbbbbbbbbbbb3","policy_hash":"sha256:ccccccccccccccccccccccccccccccccccccccccccccccccccccccccccccccc3","decision":"DENY","timestamp":"2026-06-16T12:00:00Z","signature":"ed25519:deny-fixture-signature"}
