{"receipt_id":"66666666-6666-4666-8666-666666666666","packet_id":"550e8400-e29b-41d4-a716-446655440002","action_hash":"sha256:aaaaaaaaaaaaaaaaaaaaaaaaaaaaaaaaaaaaaaaaaaaaaaaaaaaaaaaaaaaaaaa5","input_hash":"sha256:bbbbbbbbbbbbbbbbbbbbbbbbbbbbbbbbbbbbbbbbbbbbbbbbbbbbbbbbbbbbbbb5","policy_hash":"sha256:ccccccccccccccccccccccccccccccccccccccccccccccccccccccccccccccc5","decision":"HALT","timestamp":"2026-06-16T12:00:00Z","signature":"ed25519:halt-fixture-signature"}
