{"receipt_id":"33333333-3333-4333-8333-333333333333","packet_id":"550e8400-e29b-41d4-a716-446655440001","action_hash":"sha256:aaaaaaaaaaaaaaaaaaaaaaaaaaaaaaaaaaaaaaaaaaaaaaaaaaaaaaaaaaaaaaa2","input_hash":"sha256:bbbbbbbbbbbbbbbbbbbbbbbbbbbbbbbbbbbbbbbbbbbbbbbbbbbbbbbbbbbbbbb2","policy_hash":"sha256:ccccccccccccccccccccccccccccccccccccccccccccccccccccccccccccccc2","decision":"DEFER","timestamp":"2026-06-16T12:00:00Z","signature":"ed25519:defer-fixture-signature"}
