{"receipt_id":"22222222-2222-4222-8222-222222222222","packet_id":"550e8400-e29b-41d4-a716-446655440004","action_hash":"sha256:aaaaaaaaaaaaaaaaaaaaaaaaaaaaaaaaaaaaaaaaaaaaaaaaaaaaaaaaaaaaaaa1","input_hash":"sha256:bbbbbbbbbbbbbbbbbbbbbbbbbbbbbbbbbbbbbbbbbbbbbbbbbbbbbbbbbbbbbbb1","policy_hash":"sha256:ccccccccccccccccccccccccccccccccccccccccccccccccccccccccccccccc1","decision":"MODIFY","timestamp":"2026-06-16T12:00:00Z","signature":"ed25519:modify-fixture-signature"}
