{"receipt_id":"11111111-1111-4111-8111-111111111111","packet_id":"550e8400-e29b-41d4-a716-446655440000","action_hash":"sha256:aaaaaaaaaaaaaaaaaaaaaaaaaaaaaaaaaaaaaaaaaaaaaaaaaaaaaaaaaaaaaaaa","input_hash":"sha256:bbbbbbbbbbbbbbbbbbbbbbbbbbbbbbbbbbbbbbbbbbbbbbbbbbbbbbbbbbbbbbbb","policy_hash":"sha256:cccccccccccccccccccccccccccccccccccccccccccccccccccccccccccccccc","decision":"ALLOW","timestamp":"2026-06-16T12:00:00Z","signature":"ed25519:allow-fixture-signature"}
